{
  "schema": "codecks.autonomous-maturity.m24-preflight.v2",
  "milestone": "M24",
  "evidenceLevel": "PREFLIGHT_ONLY",
  "verdict": "NO_GO",
  "generatedAtUtc": "2026-08-18T19:08:51Z",
  "sourceCommit": "766ef5bc28a6b8ab9400a9ce2359ede21526ecff",
  "provenance": {
    "baseCommit": "9eb4bcd86a95440ee28c0e3191761c1c5725f5bc",
    "implementationCommit": "766ef5bc28a6b8ab9400a9ce2359ede21526ecff",
    "implementationPaths": [
      {
        "path": "docs/release/M24_CURRENT_PREFLIGHT.md",
        "change": "ADDED",
        "baseSha256": null,
        "implementationSha256": "7bdb3d454bcc67fc7303be2855ad83ae2093a3cd7871bbb6fea23fcd6f1f10ef",
        "patchSha256": "85f16ccc511052590f509cb111dc0f96b24d718cf9795355de004349e31555be"
      },
      {
        "path": "tasks/AUTONOMOUS_MATURITY_TODO.md",
        "change": "MODIFIED",
        "baseSha256": "194ae98b77e074f7cad5a215f5d4ed1bdcbe6db7695b2ab417030ce4c7c245f8",
        "implementationSha256": "8963ca5dd6b5a8f9a509bdbb09d579e2dc99ac7c98b93d0581e1a1c8428eda40",
        "patchSha256": "b92cc09c7a9756140114d7a0a89b9d6143f7f5c84cc40afc2ba5d8fd1093c00a"
      },
      {
        "path": "tools/evidence/collect_m24_release_preflight.py",
        "change": "MODIFIED",
        "baseSha256": "0d7b844be5cc4a99573ce7dac90438ee7c301cad2ceed889deaa7582b01be7db",
        "implementationSha256": "9e1be5a437084470c3747102a0e7c798821c0e54535a9a166cb248d0968dde6e",
        "patchSha256": "f8a91e6866e7e40c9b99a583e1efaefc69224df57b75a57f972181cdb5fbd7f4"
      },
      {
        "path": "tools/evidence/test_m24_release_preflight.py",
        "change": "MODIFIED",
        "baseSha256": "3dea5c2f8ed1b2620aff91f19a3d51071fdb211295efb1f9d6e2f497e1489ec6",
        "implementationSha256": "5c5514b952a7e6be58d2d8e68ad8568bf318b6d2d8f91dbac3a341c9e7392ec1",
        "patchSha256": "76c7ab4a12aed97bcb11e16cfa53a0e431c975d6efc8ba58a961e0616e0501f9"
      },
      {
        "path": "tools/evidence/validate_m24_release_preflight.py",
        "change": "MODIFIED",
        "baseSha256": "26cab30d6dd5a7b015011c8fe867a9956f7f35cd9451db1d5cf8fc207de286b5",
        "implementationSha256": "81c994b73cace179b8db2f72e8297a3e095d571dd8c46ef24b938d3cb0c5c54e",
        "patchSha256": "a98eab52db286baa0225b087dcd3fb6af9a14fc886ac682e50acb5bceb66c3ec"
      },
      {
        "path": "tools/evidence/schemas/autonomous-maturity-m24-preflight-v2.schema.json",
        "change": "ADDED",
        "baseSha256": null,
        "implementationSha256": "7cb573b18fe89490709aa9ae57fa41861acd942a4888eb0faa43f5a3b58d3f2d",
        "patchSha256": "cd395dbcd6048bd28697bd28c7f3c04bb74e386cc413fe174250031a78d78467"
      }
    ],
    "implementationDiffSha256": "4419c09730cf3577f120a106dd3e3d7d0e24532ac8b6560a53dbece07b849f80",
    "receiptPath": "tasks/test-evidence/autonomous-maturity-m24-preflight.json",
    "receiptCommitRequired": true
  },
  "sources": [
    {
      "path": ".github/workflows/release.yml",
      "status": "PRESENT",
      "sha256": "07e18f4ab4c6164f0602b1d0de636d63e30ca31f7481d132c69ae7891c5ecf90"
    },
    {
      "path": "app/build.gradle.kts",
      "status": "PRESENT",
      "sha256": "a457c7b5718d7a80fdbe4028ef2289a9ea7323e7065b3bb06a02d9f99b429263"
    },
    {
      "path": "docs/release/M23_LOCAL_PREFLIGHT.md",
      "status": "PRESENT",
      "sha256": "12468dfb576a9eff712af75c6a848cfea3536b2a6bb5ef0a0051d010ea484fa8"
    },
    {
      "path": "docs/release/M24_CURRENT_PREFLIGHT.md",
      "status": "PRESENT",
      "sha256": "7bdb3d454bcc67fc7303be2855ad83ae2093a3cd7871bbb6fea23fcd6f1f10ef"
    },
    {
      "path": "docs/release/production-state.json",
      "status": "PRESENT",
      "sha256": "4cca496cff13a5b063bb4144bd2ec3a308fde1051aa7571eea44e42d64b0c0a8"
    },
    {
      "path": "scripts/m16_autonomous_soak.py",
      "status": "PRESENT",
      "sha256": "81548fa10f67e900b8541037b7c4b6f38ddda22232499605b9a072e4fa95240b"
    },
    {
      "path": "scripts/verify_release_no_shrink.sh",
      "status": "PRESENT",
      "sha256": "6fdf7ab044267c38e73777f2b74c2d39ffe883becc1ba0937f6711f5fddd193b"
    },
    {
      "path": "tasks/AUTONOMOUS_MATURITY_TODO.md",
      "status": "PRESENT",
      "sha256": "8963ca5dd6b5a8f9a509bdbb09d579e2dc99ac7c98b93d0581e1a1c8428eda40"
    },
    {
      "path": "tasks/test-evidence/autonomous-maturity-m16-soak.json",
      "status": "ABSENT",
      "sha256": null
    },
    {
      "path": "tasks/test-evidence/autonomous-maturity-m20-rollback-rehearsal.json",
      "status": "PRESENT",
      "sha256": "b6690f51d02995ea9d9dabe7e98144e2c10f301dc4f068d0997c7de37596e5ac"
    },
    {
      "path": "tasks/test-evidence/m21-public-release-live.json",
      "status": "PRESENT",
      "sha256": "0ec73d0bec68d91c3933c4963b93ec4fccdb44047587b794af12f5921d202d85"
    },
    {
      "path": "tools/evidence/collect_m20_rollback_rehearsal.py",
      "status": "PRESENT",
      "sha256": "aeee48e892c9e1d49c36f40f843141f27c50cfc262adebf706694c24d3e6030a"
    },
    {
      "path": "tools/evidence/collect_m21_public_release_live.py",
      "status": "PRESENT",
      "sha256": "460cad87fb460b015bc5b183250d7b25a287093687261e5a125faf646681f5ed"
    },
    {
      "path": "tools/evidence/collect_m24_release_preflight.py",
      "status": "PRESENT",
      "sha256": "9e1be5a437084470c3747102a0e7c798821c0e54535a9a166cb248d0968dde6e"
    },
    {
      "path": "tools/evidence/validate_m20_rollback_rehearsal.py",
      "status": "PRESENT",
      "sha256": "aee6d75733c97d13c9f37a2325df77d5ee8db7f7bbf3b574c4b67871c009e976"
    },
    {
      "path": "tools/evidence/validate_m21_m23_local_readiness.py",
      "status": "PRESENT",
      "sha256": "5d55e8e8ee55d0043bd8eb32aa8aab9e93d7addd5e98585722b06a60868ac038"
    },
    {
      "path": "tools/evidence/validate_m24_release_preflight.py",
      "status": "PRESENT",
      "sha256": "81c994b73cace179b8db2f72e8297a3e095d571dd8c46ef24b938d3cb0c5c54e"
    },
    {
      "path": "tools/evidence/test_m24_release_preflight.py",
      "status": "PRESENT",
      "sha256": "5c5514b952a7e6be58d2d8e68ad8568bf318b6d2d8f91dbac3a341c9e7392ec1"
    },
    {
      "path": "tools/evidence/schemas/autonomous-maturity-m16-soak-v1.schema.json",
      "status": "PRESENT",
      "sha256": "29790b59b697d8058129a66da60a4a0589d5548babd46e05ac0591e2c99b112d"
    },
    {
      "path": "tools/evidence/schemas/autonomous-maturity-m24-preflight-v2.schema.json",
      "status": "PRESENT",
      "sha256": "7cb573b18fe89490709aa9ae57fa41861acd942a4888eb0faa43f5a3b58d3f2d"
    }
  ],
  "adbClassification": {
    "status": "PASS",
    "endpoint": {
      "host": "127.0.0.1",
      "port": 5037
    },
    "protocol": "ADB_SERVER_HOST_PROTOCOL_V1",
    "request": "host:devices-l",
    "responseSha256": "0b90b9310fbcdba73abbcde47c90c4cc0b07bbc1502577b6e3026d9e8e7d7f4f",
    "devices": [],
    "physicalDeviceCount": 0,
    "emulatorCount": 0,
    "unknownDeviceCount": 0,
    "adbCliInvoked": false,
    "rawSerialRecorded": false,
    "packageQueryRun": false,
    "apkPullRun": false
  },
  "phone": {
    "status": "NOT_RUN",
    "physicalDeviceCount": 0,
    "installedIdentityStatus": "NOT_RUN"
  },
  "publishedBaseline": {
    "status": "PASS",
    "tag": "v0.1.37",
    "package": "app.codecks",
    "versionCode": 37,
    "versionName": "0.1.37",
    "apkSha256": "8c8eca1b3e4b0f56a2128185c42a062687011e68a9d3fd16fe24851616baa9f2",
    "signerSha256": "07a642e758f394b6aeaecfe35c64ca84d891ca4e6de4b6cc010702c0e52e2df6"
  },
  "m16": {
    "status": "NOT_RUN",
    "capacityStatus": "NOT_RUN",
    "timeStatus": "NOT_RUN",
    "plannedAvds": 4,
    "plannedProfilesPerAvd": 5,
    "plannedProfiles": 20,
    "observedProfiles": 0,
    "requiredHours": 168,
    "observedHours": 0,
    "requiredEligibleProfileHours": 3360,
    "observedEligibleProfileHours": 0,
    "requiredAcknowledgedOperations": 336000,
    "observedAcknowledgedOperations": 0,
    "receiptPath": "tasks/test-evidence/autonomous-maturity-m16-soak.json",
    "receiptPresent": false,
    "controllerPath": "scripts/m16_autonomous_soak.py",
    "controllerSha256": "81548fa10f67e900b8541037b7c4b6f38ddda22232499605b9a072e4fa95240b",
    "validatorPath": "tools/evidence/validate_m16_autonomous_soak.py",
    "validatorSha256": "b4e6587f36b246e0b6412bd295c16f18d9b6aabc6ea0bbfcdbc5ebf081e7a249",
    "schemaPath": "tools/evidence/schemas/autonomous-maturity-m16-soak-v1.schema.json",
    "schemaSha256": "29790b59b697d8058129a66da60a4a0589d5548babd46e05ac0591e2c99b112d"
  },
  "m20Closure": {
    "status": "COMPLETE",
    "integrationCommit": "a5d0cc09d47179d30227369802932f29f1d82a18",
    "receiptPath": "tasks/test-evidence/autonomous-maturity-m20-rollback-rehearsal.json",
    "receiptSha256": "b6690f51d02995ea9d9dabe7e98144e2c10f301dc4f068d0997c7de37596e5ac",
    "receiptSchema": "codecks.autonomous-maturity.m20-rollback-rehearsal.v1",
    "collectorPath": "tools/evidence/collect_m20_rollback_rehearsal.py",
    "collectorSha256": "aeee48e892c9e1d49c36f40f843141f27c50cfc262adebf706694c24d3e6030a",
    "validatorPath": "tools/evidence/validate_m20_rollback_rehearsal.py",
    "validatorSha256": "aee6d75733c97d13c9f37a2325df77d5ee8db7f7bbf3b574c4b67871c009e976"
  },
  "m21Closure": {
    "status": "LOCAL_COMPLETE",
    "integrationCommit": "0a8f84faddbe8a1015a85f6431fd14d68b402c73",
    "receiptPath": "tasks/test-evidence/m21-public-release-live.json",
    "receiptSha256": "0ec73d0bec68d91c3933c4963b93ec4fccdb44047587b794af12f5921d202d85",
    "receiptSchema": "codecks.m21.public-release-live.v2",
    "collectorPath": "tools/evidence/collect_m21_public_release_live.py",
    "collectorSha256": "460cad87fb460b015bc5b183250d7b25a287093687261e5a125faf646681f5ed",
    "validatorPath": "tools/evidence/validate_m21_m23_local_readiness.py",
    "validatorSha256": "5d55e8e8ee55d0043bd8eb32aa8aab9e93d7addd5e98585722b06a60868ac038"
  },
  "m23": {
    "status": "NOT_A_CANDIDATE",